{
  "$schema": "https://neurolab-ai.github.io/roadmap/publication/public-roadmap.schema.json",
  "schemaVersion": "3.1.0",
  "publication": {
    "title": "NeuroLab Public Roadmap",
    "version": "0.7.0",
    "status": "draft",
    "releasedOn": null
  },
  "releases": [
    {
      "id": "genesis",
      "title": "NeuroLab: Genesis",
      "targetLabel": "September 2026",
      "stageId": "q3-2026",
      "sequence": 1,
      "description": "Bio.xyz Ignition Sale, full-featured interactive public application demo, beta testing cohort, GitBook documentation, inference benchmarking, load testing, public whitepaper release.",
      "deliverables": [
        "Public Demo and Walkthrough",
        "Beta Testing Cohort",
        "Bio.xyz Ignition Sale",
        "GitBook Documentation",
        "Public Whitepaper"
      ],
      "completedDeliverables": ["Public Whitepaper"],
      "validation": [
        "The Bio.xyz launchpad page and Ignition Sale go live with approved public materials.",
        "Release of a publicly accessible and interactive demo of the NeuroLab application: the demo allows any user to complete a full-featured walkthrough of the five main modules in the application's current architecture.",
        "The Beta Testing Cohort completes the core inference workflow and structured feedback cycle.",
        "GitBook documentation is publicly accessible, versioned, and includes user guides, evaluation-method descriptions, and knowledge graph specifications.",
        "Inference benchmarks meet the declared acceptance thresholds, and the demo remains stable under the defined load-test profile."
      ],
      "relatedInitiativeIds": ["PROD-04", "VAL-01", "VAL-03"]
    },
    {
      "id": "atlas",
      "title": "NeuroLab: Atlas",
      "targetLabel": "October 2026",
      "stageId": "q4-2026",
      "sequence": 2,
      "description": "A free user tier with 50 fully addressable datasets and interactive knowledge graph exploration.",
      "deliverables": [
        "Public free-tier access",
        "50-dataset index",
        "Interactive knowledge graph",
        "Atlas dataset and feature documentation",
        "Web2 and Web3 account access"
      ],
      "completedDeliverables": [],
      "validation": [
        "All 50 datasets return results against the published test-query set.",
        "Supported Web2 and Web3 authentication flows complete successfully."
      ],
      "relatedInitiativeIds": ["PROD-07", "PROD-04"]
    },
    {
      "id": "axon",
      "title": "NeuroLab: Axon",
      "targetLabel": "January 2027",
      "stageId": "q1-2027",
      "sequence": 3,
      "description": "Versioned APIs, MCP agent access, per-section report payments, and third-party tool integrations.",
      "deliverables": [
        "API v1 and changelog",
        "MCP server",
        "Per-section report payments",
        "Named third-party integration"
      ],
      "completedDeliverables": [],
      "validation": [
        "An external agent successfully calls the MCP server.",
        "The first paid report section is transacted on-chain."
      ],
      "relatedInitiativeIds": ["AGT-01", "PROD-04"]
    },
    {
      "id": "frontier",
      "title": "NeuroLab: Frontier",
      "targetLabel": "Q1 2027",
      "stageId": "q1-2027",
      "sequence": 4,
      "description": "Novel-structure and peptide inference, expanded pharmacology, and provenance-bound evidence intake.",
      "deliverables": [
        "Novel-structure inference",
        "Peptide inference",
        "Expanded pharmacology",
        "Provenance-bound evidence intake"
      ],
      "completedDeliverables": [],
      "validation": [
        "A published test set returns provenance-linked outputs for at least one novel structure and one peptide."
      ],
      "relatedInitiativeIds": ["ML-02", "ML-05", "KG-01", "KG-02"]
    },
    {
      "id": "workbench",
      "title": "NeuroLab: Workbench",
      "targetLabel": "Q2 2027",
      "stageId": "q2-2027",
      "sequence": 5,
      "description": "Personalized research libraries, comparative subgraph analysis, compound cohorts and molecule portfolios, hypothesis generation and publication drafting.",
      "deliverables": [
        "Personalized research libraries",
        "Comparative subgraph analysis",
        "Compound cohorts",
        "Molecule portfolios",
        "Hypothesis generation",
        "Publication drafting"
      ],
      "completedDeliverables": [],
      "validation": [
        "A user can save a research library, compare a compound cohort, generate a supported hypothesis, and produce a publication draft."
      ],
      "relatedInitiativeIds": ["PROD-06", "PROD-01", "PROD-04"]
    },
    {
      "id": "cortex",
      "title": "NeuroLab: Cortex",
      "targetLabel": "Q3 2027",
      "stageId": "q3-2027",
      "sequence": 6,
      "description": "Typed causal state, branch-preserving and abductive reasoning, multiscale whole-brain mapping.",
      "deliverables": [
        "Typed causal state",
        "Branch-preserving reasoning",
        "Abductive reasoning",
        "Multiscale whole-brain mapping"
      ],
      "completedDeliverables": [],
      "validation": [
        "A published evaluation preserves competing causal branches and produces a traceable multiscale brain map."
      ],
      "relatedInitiativeIds": ["NS-01", "NS-02", "NS-03", "BRN-01", "BRN-02"]
    },
    {
      "id": "commons",
      "title": "NeuroLab: Commons",
      "targetLabel": "Q3 2027",
      "stageId": "q3-2027",
      "sequence": 7,
      "description": "Community compound submissions with automated leaderboards and voting, shared IP terms for novel candidates, and direct IPT proposal generation.",
      "deliverables": [
        "Community compound submissions",
        "Automated leaderboards",
        "Community voting",
        "Shared IP terms",
        "IPT proposal generation"
      ],
      "completedDeliverables": [],
      "validation": [
        "The first eligible compound proceeds through submission, ranking, voting, and IPT proposal generation."
      ],
      "relatedInitiativeIds": []
    }
  ],
  "stages": [
    {
      "id": "q3-2026",
      "title": "Q3 2026",
      "order": 1,
      "description": "Foundation hardening for evaluation, reproducible publication, and versioned delivery infrastructure."
    },
    {
      "id": "q4-2026",
      "title": "Q4 2026",
      "order": 2,
      "description": "Public report delivery, expanded evidence routing, peptide inputs, and calibrated evaluation."
    },
    {
      "id": "q1-2027",
      "title": "Q1 2027",
      "order": 3,
      "description": "Novel-structure inference, typed causal state, comparative intelligence, and scaled evidence acquisition."
    },
    {
      "id": "q2-2027",
      "title": "Q2 2027",
      "order": 4,
      "description": "Composed mechanistic reasoning, persistent workspaces, multiscale neuroanatomy, and independent validation."
    },
    {
      "id": "q3-2027",
      "title": "Q3 2027",
      "order": 5,
      "description": "Bounded abductive reasoning and molecular-to-network research targets."
    }
  ],
  "categories": [
    {
      "id": "product-and-researcher-workflows",
      "title": "Product and researcher workflows",
      "abbreviation": "Product",
      "visualToken": "product",
      "order": 1
    },
    {
      "id": "api-and-agent-infrastructure",
      "title": "API and agent infrastructure",
      "abbreviation": "API",
      "visualToken": "api",
      "order": 2
    },
    {
      "id": "knowledge-graph-and-evidence-acquisition",
      "title": "Knowledge graph and evidence acquisition",
      "abbreviation": "Knowledge graph",
      "visualToken": "knowledge",
      "order": 3
    },
    {
      "id": "predictive-models-and-novel-structure-inference",
      "title": "Predictive models and novel-structure inference",
      "abbreviation": "Predictive models",
      "visualToken": "models",
      "order": 4
    },
    {
      "id": "neurosymbolic-reasoning",
      "title": "Neurosymbolic reasoning",
      "abbreviation": "Neurosymbolic",
      "visualToken": "reasoning",
      "order": 5
    },
    {
      "id": "whole-brain-and-measurement-modeling",
      "title": "Whole-brain and measurement modeling",
      "abbreviation": "Brain modeling",
      "visualToken": "brain",
      "order": 6
    },
    {
      "id": "validation-and-scientific-governance",
      "title": "Validation and scientific governance",
      "abbreviation": "Validation",
      "visualToken": "validation",
      "order": 7
    }
  ],
  "initiatives": [
    {
      "id": "VAL-01",
      "categoryId": "validation-and-scientific-governance",
      "sequence": 1,
      "stage": "q3-2026",
      "visibility": "primary",
      "title": "Versioned Evaluation Cohorts",
      "outcome": "Bind published evaluation claims to stable cohorts, explicit denominators, and leakage-resistant holdouts.",
      "maturity": "Current substrate / expansion",
      "confidence": "High",
      "horizon": "Launch / near term",
      "details": {
        "currentFoundation": "De-leak correction, canonical validation report, versioned artifacts, and documented split-governance direction.",
        "primaryUserValue": "Trust that published metrics refer to a stable, inspectable evaluation target.",
        "dependencies": "Frozen manifests, source split reconstruction, scaffold IDs, temporal partitions, baselines, and promotion policy.",
        "validationGate": "Reproducible cohort reconstruction, disjointness audits, leakage checks, and immutable result binding.",
        "claimBoundary": "A development cohort is not an untouched independent test, and artifact hashes are not scientific accuracy."
      }
    },
    {
      "id": "PROD-04",
      "categoryId": "product-and-researcher-workflows",
      "sequence": 2,
      "stage": "q3-2026",
      "visibility": "primary",